{
  "id": "line-items",
  "version": "line-items-6",
  "notes": "What each budget head is, and for the largest of them what it is actually spent on. A budget head is named for accountants — 'Capital Outlay on Defence Services' tells a taxpayer nothing, and a demand's own description says only that it is a demand. `summary` is one short line: what this body does, enough to tell it from its neighbours. It is uncited, because it describes a remit rather than asserting a figure. `spentOn` is the longer itemised account with published amounts, so it must be cited; amounts quoted are the Actual 2024-25 column of the cited Notes on Demands. House style is in CONTRIBUTING.md — describe the mechanism, never appraise it.",
  "items": [
    {
      "id": "demand-1",
      "summary": "PM-Kisan cash transfers, crop insurance under Fasal Bima, and the interest subsidy that makes crop loans cheap.",
      "spentOn": "Half of it is cash paid straight to farmers: ₹66,121 crore under PM-Kisan. Most of the rest lowers the cost of credit and insurance: ₹24,600 crore to agricultural lending institutions, ₹17,812 crore covering the interest banks forgo on concessional crop loans, and ₹14,473 crore towards crop insurance premiums.",
      "cite": [
        {
          "sourceId": "mof-demand-1-notes",
          "locator": "Demand No. 1, PM-Kisan / Agricultural Financial Institutions / MISS / PM Fasal Bima Yojana, Actual 2024-25"
        }
      ]
    },
    {
      "id": "demand-2",
      "summary": "The ICAR network — agricultural universities, crop and animal science institutes, and farm research stations.",
      "cite": [
        {
          "sourceId": "mof-demand-2-notes",
          "locator": "Demand No. 2, Actual 2024-25"
        }
      ]
    },
    {
      "id": "demand-3",
      "summary": "Nuclear power stations run by NPCIL, plus the atomic research establishments behind them.",
      "cite": [
        {
          "sourceId": "mof-demand-3-notes",
          "locator": "Demand No. 3, Actual 2024-25"
        }
      ]
    },
    {
      "id": "demand-4",
      "summary": "The National AYUSH Mission and the ayurveda, yoga, unani, siddha and homoeopathy institutes — AIIA, the research councils.",
      "cite": [
        {
          "sourceId": "mof-demand-4-notes",
          "locator": "Demand No. 4, Actual 2024-25"
        }
      ]
    },
    {
      "id": "demand-5",
      "summary": "The chemicals and petrochemicals industry: HIL India, the petrochemicals technology institutes, and plastics parks.",
      "cite": [
        {
          "sourceId": "mof-demand-5-notes",
          "locator": "Demand No. 5, Actual 2024-25"
        }
      ]
    },
    {
      "id": "demand-6",
      "summary": "Urea and nutrient-based fertiliser subsidy, paid to manufacturers and importers so fertiliser sells below cost.",
      "spentOn": "Paid to fertiliser manufacturers and importers rather than to farmers directly: ₹1,03,320 crore to domestic urea producers, ₹21,000 crore to urea importers, and ₹52,810 crore for phosphatic and potassic fertilisers. The payment covers the gap between what the fertiliser costs to make or import and the controlled price farmers pay for it.",
      "cite": [
        {
          "sourceId": "mof-demand-6-notes",
          "locator": "Demand No. 6, items 2.01, 2.04, 3.01 and 3.04 with their explanatory notes, Actual 2024-25"
        }
      ]
    },
    {
      "id": "demand-7",
      "summary": "Jan Aushadhi generic medicine stores, the NIPER pharmacy institutes, and pharmaceutical production incentives.",
      "cite": [
        {
          "sourceId": "mof-demand-7-notes",
          "locator": "Demand No. 7, Actual 2024-25"
        }
      ]
    },
    {
      "id": "demand-8",
      "summary": "Airports Authority of India, the UDAN regional connectivity scheme, the DGCA, and Air India's residual debt.",
      "cite": [
        {
          "sourceId": "mof-demand-8-notes",
          "locator": "Demand No. 8, Actual 2024-25"
        }
      ]
    },
    {
      "id": "demand-9",
      "summary": "Coal India and NLC India, plus mine safety and coal conservation work.",
      "cite": [
        {
          "sourceId": "mof-demand-9-notes",
          "locator": "Demand No. 9, Actual 2024-25"
        }
      ]
    },
    {
      "id": "demand-10",
      "summary": "Export promotion: the interest equalisation scheme for exporters, duty drawback, and the tea, coffee, rubber and spices boards.",
      "cite": [
        {
          "sourceId": "mof-demand-10-notes",
          "locator": "Demand No. 10, Actual 2024-25"
        }
      ]
    },
    {
      "id": "demand-11",
      "summary": "Startup Fund of Funds, industrial corridors, the patent and trademark offices, and GST refunds to industry.",
      "cite": [
        {
          "sourceId": "mof-demand-11-notes",
          "locator": "Demand No. 11, Actual 2024-25"
        }
      ]
    },
    {
      "id": "demand-12",
      "summary": "India Post — the post office network, its staff and pensions, IT modernisation, and India Post Payments Bank.",
      "cite": [
        {
          "sourceId": "mof-demand-12-notes",
          "locator": "Demand No. 12, Actual 2024-25"
        }
      ]
    },
    {
      "id": "demand-13",
      "summary": "Capital for BSNL and MTNL, telecom pensions, C-DOT research, and rural connectivity through the USO Fund.",
      "spentOn": "Mostly capital put into state-owned telecom companies: ₹72,514 crore to BSNL and ₹1,196 crore to MTNL. A further ₹18,500 crore goes to the Universal Service Obligation Fund, which pays operators to run networks in places they would not otherwise serve.",
      "cite": [
        {
          "sourceId": "mof-demand-13-notes",
          "locator": "Demand No. 13, Bharat Sanchar Nigam Limited / Mahanagar Telephone Nigam / Universal Service Obligation Fund, Actual 2024-25"
        }
      ]
    },
    {
      "id": "demand-14",
      "summary": "The Price Stabilisation Fund that buys and releases onions and pulses, consumer courts, and weights and measures.",
      "cite": [
        {
          "sourceId": "mof-demand-14-notes",
          "locator": "Demand No. 14, Actual 2024-25"
        }
      ]
    },
    {
      "id": "demand-15",
      "summary": "Free foodgrain under PMGKAY, and the Food Corporation of India that buys, stores and moves the grain.",
      "spentOn": "Almost the whole demand — ₹1,99,500 crore of ₹2,07,706 crore — is PMGKAY, the free foodgrain scheme. The money is the gap between what the Food Corporation of India pays to buy and store grain and what it is then handed out for; ₹75,495 crore of it goes to the Corporation itself.",
      "cite": [
        {
          "sourceId": "mof-demand-15-notes",
          "locator": "Demand No. 15, Pradhan Mantri Garib Kalyan Anna Yojana and Food Corporation of India, Actual 2024-25"
        }
      ]
    },
    {
      "id": "demand-16",
      "summary": "Computerising village credit societies, cooperative training institutes, and the cooperative sugar and dairy sector.",
      "cite": [
        {
          "sourceId": "mof-demand-16-notes",
          "locator": "Demand No. 16, Actual 2024-25"
        }
      ]
    },
    {
      "id": "demand-17",
      "summary": "Company registration and filings, the Competition Commission, the audit regulator NFRA, and the PM Internship Scheme.",
      "cite": [
        {
          "sourceId": "mof-demand-17-notes",
          "locator": "Demand No. 17, Actual 2024-25"
        }
      ]
    },
    {
      "id": "demand-18",
      "summary": "The Archaeological Survey of India, national museums, the akademies for art and letters, and heritage conservation.",
      "cite": [
        {
          "sourceId": "mof-demand-18-notes",
          "locator": "Demand No. 18, Actual 2024-25"
        }
      ]
    },
    {
      "id": "demand-19",
      "summary": "The Coast Guard, Border Roads Organisation, defence estates and the ministry's civilian secretariat — not the armed forces themselves.",
      "cite": [
        {
          "sourceId": "mof-demand-19-notes",
          "locator": "Demand No. 19, Actual 2024-25"
        }
      ]
    },
    {
      "id": "demand-20",
      "summary": "Pay, rations, fuel, spares and maintenance for the Army, Navy and Air Force, and DRDO's running costs.",
      "spentOn": "Running the armed forces rather than equipping them: pay, rations, fuel, spares and maintenance. The Army takes ₹1,98,026 crore of it, the Air Force ₹49,332 crore and the Navy ₹32,735 crore. Buying aircraft, ships and vehicles is a separate demand, and so are pensions.",
      "cite": [
        {
          "sourceId": "mof-demand-20-notes",
          "locator": "Demand No. 20, Defence Services - Army / Navy / Air Force / R&D, Actual 2024-25"
        }
      ]
    },
    {
      "id": "demand-21",
      "summary": "Aircraft and aero engines, warships, submarines, vehicles and ordnance — the capital half of the defence budget.",
      "spentOn": "Equipment, not people: ₹52,205 crore on other equipment, ₹44,365 crore on aircraft and aero engines, ₹25,567 crore on the naval fleet, ₹14,097 crore on research and development and ₹5,619 crore on naval dockyards. Salaries sit in Defence Services (Revenue) and pensions in Defence Pensions.",
      "cite": [
        {
          "sourceId": "mof-demand-21-notes",
          "locator": "Demand No. 21, Aircraft and Aero Engines / Naval Fleet / Other Equipments / R&D, Actual 2024-25"
        }
      ]
    },
    {
      "id": "demand-22",
      "summary": "Pensions for retired armed forces personnel and their families, including the one-rank-one-pension revisions.",